113,私立,一般大學,1005,淡江大學學校財團法人淡江大學,5414,1,5056,377,93.83,"淡江大學學風自由具深厚歷史底蘊,以優質成效贏得企業青睞,連續27年蟬聯企業最愛私校。致力於人工智慧與永續發展,將AI與SDGs相結合,以「國際化、資訊化、未來化」為核心,訂定八大素養,提升就業競爭力。將AI相關知識融入課程設計上,讓學生在學習過程中,能夠掌握AI的基本概念和應用；推出全雲端校園2.0,打破傳統教學模式,透過最新的網路科技,讓學習更靈活,也能適應現代社會的需求。獨步全國的社團必修、通識教育與跨領域教育推出多元課程,創新的彈性學制,增加學生學習選擇與靈活性及提高學生專業能力；在國際交流方面,雙聯學制及校級交換機制,提升學生國際視野與經驗。本校培養學生扎實的學術基礎,更具有實際操作能力,能迅速適應職場的需求,深受企業喜愛。本校獨特的特色,吸引眾多學生的目光,也為學生提供一個全面發展的平台,使學生擁有最佳學習體驗與成果,踏入職場時能具備競爭優勢,成為具心靈卓越的淡江人。"
113,私立,一般大學,1006,中國文化大學,4561,0,3556,163,78.73,"中國文化大學位於台北市,設有11個學院,學士班有60學系組學位學程、碩士班有40系所組學位學程、博士班有10所,為一綜合性大學。本校以發揚中華文化為主旨,系所多元完整,涵蓋各主要學術範疇；在中華文化陶冶及國際化的學習環境中,實現跨領域、跨產業、跨國界的育才目標,培養學生成為最靈活的人才！  本校為全國學系組學位學程最多之大學,提供每位學生多元學習的機會,除了雙主修輔系等選擇外,每系亦開設跨領域學分學程與專業學程。近年已取得ACCSB華文商管學院認證及IEET中華工程教育學會認證,顯示本校在教學及各項輔助資源之投入已獲認可。本校不僅重視文化傳承與創新外,同時也十分注重國際化,在全球締結超過400所姐妹校,設立跨國雙聯學位制度,更善用校內英、日、韓、俄、法等國語文學系的資源,以及全英語學位學程、華語中心,每年赴海外交流與在文大求學的境外學生多達一千多位,成功營造國際化的學習環境。"
113,私立,一般大學,1007,逢甲大學,5497,0,5344,146,97.29,"本校設有工程與科學、商、人文社會、資訊電機、建設、經營管理、金融、國際科技與管理、建築專業、創能等10個學院,學生人數逾2萬人。本校以「教學卓越、研究重點突破的亞太地區知名大學」為願景,形塑出i#的全面資訊教育升級樣貌,以培養具備產業升級社會轉型的人才,致力成為一所兼具持續創新、跨領域、國際化,且對國家社會教育具備影響力的4I大學。2024年《遠見雜誌》校長互評大學總體競爭力排行榜中,榮獲非醫科類的綜合類私校冠軍,在與AI高度相關的「資訊通訊科技」領域排名全台第九,私校第一；「工程、製造及營建」領域排名全台第八,為前十名中唯一私立大學。商、金融學院全數通過國際AACSB教育認證,工程相關學系全數通過國際IEET教育認證,教育部113年度教育部私校獎補助金額連續兩年居全台之冠。顯示逢甲近年來在推動國際化、AI+5G、教育創新及對社會產業永續發展等面向的辦學成果,受教育部和社會大眾的高度肯定。"
113,私立,一般大學,1008,靜宜大學,2581,1,2415,211,94.09,"1.本校為中部海線地區唯一綜合大學,榮獲「2024企業最愛大學生」一般私立大學TOP10；管理學院與國際學院通過全球國際商管教育品質認證(AACSB),致力培育國際商管人才接軌國際。2.全國唯一加入國際交換學生計畫(ISEP)之會員學校,提供免付國外學費與膳宿費(僅需支付靜宜學費、膳宿費和活動費)之國際交換學生與出國研修方案,合作姊妹校近500所。3.重視職涯培力,榮獲教育部青年發展署112年大專校院職涯輔導成果評選全國唯一「金等獎」。4.招生學制包括日間學制學士班、二年制進修學士班、碩士班、碩士在職專班、博士班；5.大學部新生入學管道：特殊選才、繁星推薦、申請入學、四技二專甄選入學、分發入學、運動績優及原住民專班。6.提供績優入學與學業成績優良等多項獎學金及安心就學助學方案。7.推行學碩一貫、逕讀博士班,鼓勵學生在專業領域繼續深造。8.設國民小學及中等學校教育學程,提供學生多元就業發展。"
113,私立,一般大學,1009,長庚大學,1922,0,1767,144,92.50,"本校為落實勤勞樸實生活教育及實務與理論結合之辦學理念,在董事會全力支持下,經費充裕、師資質量均優、設備新穎充足、校區環境幽雅。113學年度設有醫學、工程、管理、智慧運算四個學院,計22個學系及1個學士學位學  程、26個碩士班及7個碩士學位學程、2個碩士在職專班、12個博士班及1個博士學位學程。招生採多元入學管道,相關招生資訊請至本校招生資訊網查詢。"
113,私立,一般大學,1010,元智大學,2322,0,2211,279,95.73,"■2024遠見雜誌：台灣最佳大學排行榜非醫科一般大學私立第一,中經費大學全國第一,國際化程度全國前十強。  碩士起薪資訊、工程、管理或私校冠亞軍。  大學起薪工程、電通、資訊、管理前十強  ■EduRANK多項獲全國前10名私校第一。  ■全球TOP2% 頂尖科學家,專任教師進榜比例 非醫學類私校第一。  ■Cheers雜誌調查3000大企業經理人最想就讀私立大學首選。   ■1111人力銀行企業最愛大學私立大學前五強、資訊學群私校第一。  ■領航全球產業鏈創設企業專才基地,成為國際化指標大學。  ■首創桃園「微軟國際課程與認證中心」攜手遠傳,打造5G雲端智慧校園。  ■推動淨零永續與社會共融校園。  ■首推Google, Microsft, Amazon 三雲認證雲端課程。  ■設立醫護學院,創新智慧醫療  ■以創新跨域教學和重點研究特色。  ■首創量子AI教育,培養高素質科技人才。"
113,私立,一般大學,1011,中華大學學校財團法人中華大學,1453,22,894,209,67.26,"本校定位為一所優質教學及產學鏈結雙導向之大學,以培養陽光青年並積極推動創新創業普及教育及跨領域學習為目標,同時為強化學生就業力,積極鏈結園區合作並推動企業實習與專業證照,使學生做好充分的就業準備,除與國內外186餘家企業或公部門實習合作,鼓勵學生參與實習；另攜手微軟公司合作舉辦「微軟AI證照培訓營」,提供全額免費的專業講師課程與考證活動,培養學生具備跨領域專業與職場競爭力。本校畢業生不僅具有就業率高及薪資高等表現外,同時,工程相關學系皆通過IEET工程認證,管理學院亦取得國際AACSB認證,躋身世界頂尖前5%商管學院；另在遠見雜誌台灣最佳大學排行榜中,本校連續四年於教學表現指標中教育部教學實踐研究計畫每師平均件數獲全台第一,再顯示學校各方面具備深厚的辦學基礎。"
113,私立,一般大學,1012,大葉大學,1533,0,832,73,56.35,"本校現有（113學年度）工學院、管理學院、設計暨藝術學院、外語學院、生物科技暨資源學院、觀光餐旅學院及護暨健康學院等7個學院,計有22個學系、1個獨立研究所、5個學位學程、以及4個學院班別對外招生,合計有26個學士班、2個進修學士班、1個二年制在職專班、19個碩士班、5個碩士在職專班及5個博士班之綜合大學。提供學生夠充分發揮想像力與創造力之環境,並創造高品質之教學與研究環境、培養高創力及豐富科學內涵之專業人才,強調「理論與實務並重」、「人文與科技整合」、「師傅與徒弟傳承」與「產業與學術合作」等教育理念,營造良善住宿環境,深化四肯品德教育培養具「肯學、肯做、肯付出、肯負責」四肯態度之大葉學生,實現「創意的產業人」、歡迎的「合作的工作夥伴」、具「競爭力的現代國民」,以及「關懷的世界公民」之教育目標,期以此等理念與目而達成「產業導向之綜合大學」之定位,完成「企業夥伴型大學」之發展願景。"
113,私立,一般大學,1013,華梵學校財團法人華梵大學,449,0,326,17,73.61,"1.一所重視品德,致力培養具備文化涵養之專業人才的住宿型大學；公車與專車便捷生活,住宿仍享大臺北政經文化地利優勢。2.全力提升語言表達能力、培養關鍵競爭力,每位學生提供客製化的中、英文能力學習途徑。學生出國學習：學校補助經費減輕同學負擔,每位同學都有能力出國學習,海外交換、遊學、實習與雙聯學位等經驗。3.厚植專業能力/動手實作PBL/跨領域自主學習：以培養應用實務型人才為目標,強調動手實作學習、行動學習,在實際情境中進行創作或解決具體問題。鼓勵創業、創新、實作學習；推動跨領域的專題式學習,學生必須整合不同領域的知識,解決實際的問題或進行實務的創作。4.全國唯一全校學生皆有個人獨立工作空間：每一個同學都可在專屬空間內,隨時進行專業創作、研究或討論,培養強大實務能力。5.校外實習接軌產業：重視學生的實務能力,每一位學生在畢業前,安排到校外實習至少一學期,以接軌業界,培養就業競爭力。"
113,私立,一般大學,1014,義守大學,2705,55,2085,279,80.71,"義守大學為一所人文與科技並重、多元人才培育的國際化綜合大學,辦學績效卓著,為外界評比優良的私立大學之一,在英國泰晤士報高等教育特刊,2015年義守大學入列全球800名大學,其中教學成績為全台灣第14名,2016年列入亞洲前200名大學排行榜。2018年入選英國《泰晤士報》全球最佳年輕大學,2019年入選《遠見雜誌》台灣最佳大學排行榜,全國綜合大學前18名、南部私校綜合大學第1名。2021 年起,連續3年登榜QS 亞洲大學排名,整體表現位居401-450 名。"
113,私立,一般大學,1015,世新大學,2712,2,2599,131,96.09,"本校定位為「精緻的教學卓越大學」,近年持續發展「數位傳播貫穿各學門、數據智能結合各專業」之辦學特色,積極優化師資結構、提升教學品質及追求創新卓越,培育「具有教養、宏觀、專業知能及國際視野之公民」為願景,致力完善「厚植學生基礎能力」、「培養學生就業能力」、「建構跨域學習環境」、「發展創新教學模式」、「建構創新創業生態環境」等創新架構,以傳播力、創新力、即戰力實施教育創新。本校擁有全臺最先進的LVS智能攝製基地、全媒體中心,並以「AI深度學習、AI生成內容、AI數據分析、AI應用程式、AI倫理法律」五大方向,引領新聞傳播、管理、人文社會、法律等四學院師生,掌握AI科技與工具,融入課程教學活動與產出新穎內容作品,為學生提前建構AI傳播跨域專才的強大即戰力。  本校施行「築夢翠谷助學措施」,提供大學部低收、中低收入戶學生四年學雜費全免,每學年9個月的「生活助學金」,增加助學範圍嘉惠學子不遺餘力。"
113,私立,一般大學,1016,銘傳大學,4107,0,3869,421,94.74,"1.銘傳大學係為紀念台灣首任巡撫劉銘傳而設立的知名大學,擁有66年的辦學經驗。2010年獲得美國MSCHE認證,成為亞洲唯一一所美國認證大學。2016年6月再次通過MSCHE 10年認證,與哥倫比亞大學、紐約大學、馬里蘭大學、賓州大學、康乃爾大學為同一認證體系。2017年7月管理學院通過AACSB國際認證。2.設有11個學院、43個學系,17萬校友及1.8萬名學士生、碩士及博士生,深受陸生及國際生喜愛,陸生人數名列前茅。3.英國高等教育調查公司(QS)公布「2023亞洲大學排名」,連續6年進榜,榮登全球著名學府。4.與全球202所知名大學締結姐妹校,外籍生數1111人。5.連續10年獲教育部「大學教學卓越計畫」獎勵,教學成效倍獲肯定。2022年連續5年獲高教深耕計畫補助。6.教師教學認真嚴謹指導學生參加科技部大專學生研究計畫,2022年獲獎勵數125件,全台第4名,私校綜合大學第1名。"
113,私立,一般大學,1017,實踐大學,3109,0,2361,194,77.35,"本校持續榮獲教育部教學實踐研究計畫、學海計畫、議題導向敘事力創新教學發展計畫與高教深耕計畫的認同及肯定,亦常於各種國內外賽事中獲獎。招生特色：一、多元敬業學士生：致力培養學生自主學習與多元發展,除教師教學創新外,更融合多元社團活動與服務學習,還有跨國文化交流機會,藉以期許培養學生畢業即就業的能力,亦在夜間提供在職進修機會。二、跨域分流碩士生：本校碩士班學生理論與實務兼容,學系指導過程更依特質強化其專業或實務能力,不僅課程多元,亦提供學生許多機會,透過實作與實務經驗學習,因此學生在畢業後深獲企業喜愛。亦有碩士在職專班,提供終身學習機會。三、創意思維博士生：隨著數位科技的進步,「創意產業」逐漸成為許多國家推動經濟復甦及產業轉型的引擎。以創意為校務發展DNA,為深耕創意教學,擴大創意與產業結合邊際效益,遂於2012年正式成立管理學院創意產業博士班,招收來自各行各業的人士就讀。"
113,私立,技專校院,1018,朝陽科技大學,2933,0,2759,333,94.67,"朝陽科技大學定位為以產學實務為導向之教學型大學,致力推動以創意、創新、創業為主軸之三創教育,提供學生跨領域的國際化學習。目前與全球超過640所姊妹校簽訂學術合作協議,積極推動千人海外體驗學習計畫,不但延攬斯洛伐克、澳洲、印度及新加坡等10國師資,更斥資7億元設立航空學院,依循航空公司三大業務主軸航務、機務、運務進行完整規劃,為學子打造飛航圓夢基地,培育航空菁英。此外,朝陽科大亦積極強化重點特色計畫,整合「非破壞檢測研發中心」、「環境資源永續再利用研發中心」、「健康農糧中心」、「A2I智慧產業技術研發中心」等四大校級研究中心,致力建構友善生態環境,積極推動聯合國永續發展目標（SDGs）,善盡大學社會責任不遺餘力。"
113,私立,一般大學,1019,高雄醫學大學,1812,0,1637,65,90.68,"高醫大創立於民國43年,是全臺第一所私立醫學院；民國88年改名為高雄醫學大學,也是全臺第一所私立醫學大學。創校邁入第70年,歷經所有高醫人的努力耕耘,學校目前有七個學院、一個通識教育中心,以及附設中和紀念醫院、附設高醫岡山醫院,還有接受高雄市政府委託經營的部分醫院,校、院相輔相成,形成一個南臺灣最大、最完整的醫學教育與醫療服務體系,使高醫學子擁有全方位的學習環境,是實習的最佳場域。本校重視學生醫學人文與品德教育的培養,由師長帶領學生與附設醫院同仁一起援助原鄉和國際友邦的醫療服務,校院攜手合作踐履大學社會責任深獲各界認同；歷年至113年10月止,已有50位師長與校友榮獲醫療奉獻獎,是得獎人數居冠的醫學校院。本校與國內各公立大學也有相關學程和學術研究的合作,更與其他頂尖大學開設跨域遠距視訊課程,為大家開啟了多元、跨領域學習的管道。"
113,私立,一般大學,1020,南華大學,1508,0,1336,39,88.88,"南華大學成立於１９９６年,是佛光山星雲大師發起「百萬人興學」募款而創設。本校秉持「提升生命價值與永續發展,培養慧道中流的南華人」的教育願景,以「生命關懷、公益公義、國際知名的教學卓越大學」為自我定位,實踐「以生命力帶動三好生命力、以學習力提升就業競爭力、以全球觀促進國際移動力」的教育理念,並以「生命教育、環境永續、智慧創新、三好校園」為辦學特色,致力打造為一所深耕生命教育邁向永續發展的大學。本校強調創新、跨域及自主學習,引導學生習得帶得走的能力及跨域能力。秉承星雲大師「做好事、說好話、存好心」的理念,形塑三好校園。此外,積極推動學生海外學習、２＋２雙學位及擴大國際交流與合作,促使「南華走向世界,世界走向南華」,以全面提升國際移動力。最後,本校致力推動「永續環境,營造樂活森林校園」,並以身心靈平衡為重點,強化生命教育、環境與永續發展,以實現「生命教育與環境永續典範大學」。"
113,私立,一般大學,1021,真理大學,1090,0,267,94,30.49,【1】本校「通過」高等教育評鑑中心基金會大學校院校務評鑑;【2】本校獲教育部大專校院體育專案評鑑為「一等」(全國最優成績);【3】本校為獲教育部體育署表揚長期推動學校體育志工的5所優良大學;【4】本校獲台灣輔導與諮商學會頒發「推行輔導工作績優學校」;【5】本校「通過」國際標準組織ISO9001/IWA2教育品質管理驗證。
113,私立,一般大學,1022,大同大學,962,0,885,17,92.13,"一、本校位居臺北市中心,校區鄰近花博公園及捷運站（民權西路、圓山及中山國小站）,生活機能完善,為理想的學習環境。二、本校秉持「培育優秀工業人才」創校初衷與「建教合一、研究發展、正誠勤儉、工業報國」的教育理念,堅持小而美、優質、精緻、跨領域的教學特色,致力於培養能解決問題的人才。本校與國內外一流企業進行密切產學交流,培育務實致用之俊才。三、本校實踐「公益興學」之創校精神,設立「公益興學獎學金」,提供每位大學部與研究所學生1.5萬獎學金/年,相當於公立大學收費。此外,亦提供高額升學獎學金之尚志獎學金最多8學期共100萬元。四、本校屢獲教育部各項競爭型計畫補助,且各系所皆通過IEET工程/設計教育認證及教育部認可機構之系所品保認證,並通過第三週期校務評鑑,展現亮眼校務發展與辦學績效。五、本校積極與國際姊妹校進行交流,推動豐富且多樣的國際工作營/講座、海外實習等活動,有效拓展學生國際視野。"
113,私立,技專校院,1023,南臺學校財團法人南臺科技大學,4094,0,3354,110,82.40,"本校以「信義誠實」為校訓,在校歌中清楚明示：以「樂育英才、造福社會、建設國家」為創校宗旨,學術及技術並重,並以嚴謹務實之辦學態度,規劃具前瞻性之學校總體發展目標與校務發展計畫,期能充分利用資源,強化教學品質與提升研發水準。本校參考標竿學校日本立命館大學之「畢業即就業」辦學理念,培育兼具專業技能與人文素養之務實致用產業人才。為建立「產學無縫接軌」的親產學校園環境,本校配合國家產業政策,著力於產業技術之創新改良,突破技術瓶頸,以協助產業發展為使命。"
113,私立,技專校院,1024,崑山科技大學,2093,0,1296,859,73.00,"地點最優、機能完備：在大臺南城鄉交會中心,共3路公車直達,鄰大灣交流道,近臺鐵和高鐵車站。20餘頃寬闊校園,臺南地區校地最廣之科技大學。周邊有大灣、成大和南紡購物中心等商圈,生活機能完備。  實習工廠、鏈結產業：學系多元且契合政府產業策略,為建構好就業環境,特按教育部類產線工廠規範,共打造4間國家級和7間校級的「類產線工廠」,作為學生實作場域,落實跨領域的技術實作課程,提高學生就業競爭力。  接軌產業、企業最愛：近臺南科學園區和科技工業區,產業資源連結豐富,具體培育學生擁有實作能力,超過1400家企業攜手簽訂人才培育計畫；與美國、日本等國產業推動國際產學合作。逾15萬餘名校友跨足各大產業,龐大綿密的網絡團結崑山校友,成為企業最愛。  學雜費最低、獎助金豐厚：學雜費是雲嘉南地區私立科大最低,善盡社會責任；運用外部補助款設各類獎助學金,讓學生安心就學；海外實習交流或研習,可申請補助來圓夢。"
113,私立,技專校院,1025,嘉藥學校財團法人嘉南藥理大學,2718,0,1775,250,68.23,"本校現有日間部、進修部,設有碩士班、四年制、二年制及五專等學制,分別設置藥理、智慧生活、環境永續暨休閒等3大學院,共計24個系(含碩士班)、3個學士學位學程及9個專科。以「藥理」與「健康」為核心主軸,積極推動「藥食粧安」、「智慧健康」及「資源永續」之發展特色及育才目標,務期邁向「健康促進」為體、「健康務實」為用,以「樂活(LOHAS）創新服務」為定位的綜合型大學,重視理論與實務並重及專業技術能力之訓練,積極強化學生語文及資訊能力,拓展學生國際視野,建立多元文化之國際觀,透過與企業產學攜手及與產官學研界合作交流,提供學生優質的實習環境及就業機會。希冀培養兼具專業技能與人文素養菁英與人才,貢獻國家發展。"
113,私立,技專校院,1026,樹德科技大學,2789,0,2026,268,75.04,"本校是一所以學生為主、教學為要、實務為重、產研為本、就業實務應用為導向之科技大學；營造具備優質化、多元化、國際化、及特色化之學習環境,培育術德兼備、誠懇踏實之優秀學生,使成為業界優先選用人才。設計學院、管理學院、資訊學院、應用社會學院、通識教育學院等五大學院,著重創新實務教學,充實校內軟硬體設備；落實社會責任,實踐大學多元價值,推動跨域學習,連結在地產業與文化,實踐在地關懷；營造校園國際化學習環境,推動國際合作與移動力,提升國際聲譽；強調知識創新與國際接軌、應用實務與產業連結。優質學習環境,建構智慧校園,精進本位課程,厚實學生基礎能力,適性創新教學,提升學習成效；依據學校理念「求智、求真、求美、求善」,制定「學術、知性、快樂、希望」校訓；落實扎根教育,推動社區服務,優化學校形象；強化外語能力,增廣國際視野；建立核心專業,發展各院系特色,實務導向教學,培育實作人才。"
113,私立,一般大學,1027,慈濟學校財團法人慈濟大學,1571,1,1101,113,72.13,(1) 高等教育教學評鑑100%通過學校 (2) 全球獨創「模擬醫學人文課程」學校 (3) 多元頻繁的國際交流活動 (4) 研究品質表現佳並具學術特色的學校 (5) 全國唯一「三軌輔導」特色學校 (6) 高獎助的安心就學學校 (7) 深耕臺灣邁向國際的社會教育發展 (8) 東部志願服務典範學校 (9) 國家永永續發展獎、東部唯一綠色大學示範學校
113,私立,一般大學,1028,臺北醫學大學,1414,0,1328,196,94.66,"1.多元跨領域學程：為增進學生多元學習,發展跨領域專長,規劃數十門微學程及學分學程,修畢學程科目,可申請學程證書或學分證明書。 2.多管道見實習場所：擁有六家附屬醫院的醫學大學,包含臺北醫學大學附設醫院、萬芳醫院、雙和醫院、臺北癌症中心、新國民醫院及臺北神經醫學中心,總床數超過3,000床,已成為國內最大版圖的醫療服務教學院所之一,另與多家醫學中心結盟,具有豐沛學習環境。 3.本校與國立臺北大學、國立臺北科技大學及國立臺灣海洋大學組成「臺北聯合大學系統」。 4.另與東吳大學、文化大學、世新大學、淡江大學、銘傳大學、輔仁大學、實踐大學、大同大學、中原大學、逢甲大學,靜宜大學及東海大學組成「優久聯盟」。"
113,私立,一般大學,1029,中山醫學大學,1916,0,1783,36,93.19,"自 1960 年創校以來,中山醫學大學秉持著校訓「誠、愛、精、勤」,強調  誠實待人、愛護人群、精益求精、勤於職守。透過凝聚全校教職員生的共識,  學習標竿國際大學的教育趨勢,並結合校長的治校理念及校務發展計畫,形成  本校的校務特色：以「成為國際優質醫學大學」為願景；以「培養符合社會變  遷需求之優質健康照護人才的醫學大學」為定位；以「建構深具醫學人文與服  務胸懷,緊扣社會脈動與醫療需求」為辦學特色。"
