113,私立,技專校院,1054,景文科技大學,1275,0,915,246,76.33,"1.114學年度本校日間部四技招生為9學系、7組,三個學院1.觀光餐旅學院2.資訊科技與管理學院3.人文暨設計學院。 2.本校注重產學雙向交流,推動學生校外實習與海外實習,迄今與20國161校(單位)海外合作學校簽訂合約,每年均獲教育部學海築夢計畫補助。為培養學生具就業競爭力,大一至大四規劃一系列輔導課程與活動,以達畢業即就業之辦學宗旨。 3.建構外語教學環境強化學生外語能力,推動國際交流與師生互訪。 4.本校教師多具實務經驗,符合科技大學教育政策。 5.本校日間部學雜費屬國內私立科技大學中收費最低者,在公益董事會督導下一切學校收入用在教學研究。 6.1111人力銀行：2024年企業最愛大學【北北基私立第二/全國第六】,企業最愛休憩與運動學群【全國第三】。7.交通便利,安坑輕軌【K5景文科大站】直達本校。"
113,私立,技專校院,1055,中華醫事科技大學,2594,0,1821,76,71.05,"創校56週年的中華醫大,一向來強調全方位的教育理念,教育目標除了專業知能的發展外,也重視學生人文素養與社會關懷精神的啟發,以培養能夠適應多元社會變遷能力的青年為職志。因此,不但提供多元化的學習環境,包括知性發展、語文思考能力表達、正確的工作態度,並訓練其獨立的人格、穩定的情緒、強健的體魄與團隊合作精神,讓學生能伸展觸角,作廣泛涉獵,達成全人教育功能,增進其競爭力與發展潛能。歷年來本校學生在醫檢師、護理師、營養師、食品技師等國家考試中,及格率屢創新高；安全衛生管理師、疾病分類員、中餐烹飪、西點烘焙、檢驗分析、保育員、保母、美容師等証照技能檢定考亦捷報頻傳。校內學生社團蓬勃發展,學生參與度高,在社團活動中快樂成長學習,值得一提的是,本校運動風氣興盛,重視強建體魄之鍛練,因此田徑代表隊健兒年年都在全國大專運動會上大放異彩。"
113,私立,技專校院,1056,東南科技大學,998,1,535,438,67.80,"1.八輔合一,全人發展：透過融滲式教學在專業與博雅通識課程,融入品德教育,達到教育於無形的目的。以資訊系統進行學生學習歷程與輔導個別化紀錄,建立適性輔導系統並發揮輔導綜效。2.建構教學品保系統,維護學生受教權：學生學習品質管制則實施「1314」畢業門檻,即學生在畢業前必須取得1張服務證明；3類證照-外語能力證明、專業能力證照、資訊能力證照；完成1系修業規定；4門跨領域課程修習,為確保教學品質,參與IEET工程與科技教育認證,以提升教育品質並與國際接軌。3課程結合證照,輔導學生考取含金量高專業證照,本校擁有30個國家技能檢定考場,1個無人機操作執照考場,22個國際證照考場。4.學用合一,提升學生就業力：聘請業師進行協同教學,透過完整就業導向課程、證照輔導與專業實務實習,成為優質專業技術人才,並順利就業。5.多元多樣的跨領域微學分學習,提升創新創意,成就多元發展人生。"
113,私立,技專校院,1057,德明財經科技大學,1257,1,769,418,70.91,"1.秉持「篤信好學」校訓,培育財金、商管及資訊專長之學生。2.推動就業學程、產學合作及校外專業實習,鼓勵學生取得證照,落實就業接軌。3.致力品格教育,學程化課程設計,拓展國際交流、加強外語能力,增進國際觀,提升就業競爭力。4.通過教育部108學年度科技大學校務類評鑑;112學年度系所評鑑全數通過【臺評會大專校院教學品保服務計畫】。5.通過教育部111學年度推動技專校院實習課程績效評量。6.榮獲1111人力銀行2023企業最愛大學調查連續三年全國私立科大第二名、連續七年臺北市私立科大第一名；全國私立技專校院財務穩健第五名。7.自2019年至今連續榮獲「三好校園實踐學校」。8.自2017至今「學生會」及社團年年獲獎成績亮眼。9.與美國明尼蘇達州曼徹普立敦大學、日本熊本大學等多校簽訂大學雙聯學位,取得雙聯學位學生人數為全國公私立技專校院第二名。"
113,私立,技專校院,1060,南開科技大學,811,0,538,255,74.39,"(一)獎助學金優渥：提供約三千萬元之新生入學獎學金。 (二)辦學績效卓越：本校連續十二年獲教育部教學卓越大學獎勵,並獲高等教育深耕計畫、USR大學社會責任計畫等獎勵,中部私立科大第一。 (三)交通路線便捷：本校距臺中火車站及高鐵站約30分鐘車程,擁有中彰投縣市多條便捷之客運班車,臺中市108路公車及彰化客運17路更以本校為起迄站,可直通臺中火車站、一中街商圈及彰化火車站。 (四)學習環境優質：校園建置高速光纖及無線網路與全e化冷氣教室,採生動活潑的互動式教學。 (五)生活設施完善：校園內設置美食餐廳及新穎的冷氣網路套房式宿舍。"
113,私立,技專校院,1061,中華學校財團法人中華科技大學,1272,0,789,148,65.99,"本校配合政府培育高科技與管理人才之教育政策為依歸,秉持「誠正法新」之校訓,配合國家建設及產業發展之需要,培育科技與人文兼備之專門人才,以服務國家社會為宗旨,衍生出辦學理念為「落實技職教育、創新工商科技、推展全人教育」。本校定位為實務教學型科技大學,並以「培育具注重職業倫理、敬業精神、人文關懷的科技與專業人才」為教育目標,同時以「成為一所優質教學與產學合作具特色之科技大學」為發展願景。本校特別著重公民力、就業力與創造力等基本素養能力之養成,搭配相關課程訂定專業能力及社會能力等所需之核心能力,建立優質特色課程,並結合5G通訊傳輸技術之發展,推動數位化課程教學,以提升學校成效。同時藉由各項教學資源運用、產學鏈結、以及畢業能力檢核,期使學生畢業後能在工程、健康生活、管理、航空等領域發光發熱,以全面提昇學生就業競爭力。"
113,私立,技專校院,1062,僑光科技大學,2256,1,1879,179,84.55,僑光科技大學招生特色：  1.環境優越便利  2.深耕技職教育  3.大四全年實習  4.就業百分百  5.強調特色教學、點亮技職光芒
113,私立,技專校院,1063,廣亞學校財團法人育達科技大學,1294,11,879,426,76.36,"本校以智慧科技、觀光休閒及健康生活等三大領域為發展主軸,目前設有三個學院11系及1個學位學程：(一)科技創新學院下設資訊管理系、多媒體與遊戲設計系、物聯網工程與應用學士學位學程、智慧機電工程與應用系；(二)人文管理學院下設行銷與流通管理系、應用日語系、幼兒保育系、社會工作系；(三)休閒創意學院下設觀光休閒管理系、休閒運動管理系、餐旅經營系、時尚造型設計系。  本校推動跨領域學分學程,推動一證多照,開設證照輔導課程及輔導考照措施,搭配證照獎學金,期使畢業生擁有文憑外,亦能擁有多張專業證照,另與知名優質企業產學合作,推動學生全面實習,無縫接軌就業,畢業生就業率達83.9%以上。在國際化方面,本校選送學生進行海外實習、參與國際競賽、短期研修及海外志工服務,藉以精進學生之專業技能、拓展國際視野,強化國際移動力,最終達成「國際育達人」之教育目標。"
113,私立,技專校院,1064,美和學校財團法人美和科技大學,1794,0,1265,1,70.53,一、培養學生新五倫好品德與五靜好習慣  二、推動三明治教學與適性教學  三、推動特色翻轉課程  四、發展人工智慧照顧課程  五、實施三師合一典範學習  六、實施EMI課程教學  七、實施夜間課業輔導  八、推展學生海外帶薪實習  九、開設英語、越語及日語等外語課程供學生選修以提升其就業競爭力  十、辦理新南向產學合作專班
113,私立,技專校院,1065,吳鳳科技大學,1483,0,959,312,70.81,"本校以「安全」為發展核心,積極建構「安全科技」「安全數位」「安全照顧」三領域,計有3學院14系4碩士班,為嘉義地區第一所,也是唯一一所科技大學,以培育專業能力與人文素養兼備、具有國際觀的時代菁英、注重研究創新與社會服務的學能為用。辦學上不斷的全方位扎根,提升教學設備和產業一致,藉由企業資源導入,縮短學用落差,提供學生厚實的學習機制,致力於「畢業即就業」,讓學生成為業界最喜愛任用的員工,是我們一直努力在做與進行的目標。辦學績效卓越務實如后：  1.技能檢定/訓練場所數量雲嘉南第一,高達55種類別,22種專業能力認證教室,產學合作教育訓練中心數量雲嘉南第一。  2.技職傑出證照達人獎11連霸。  3.消防人才培育第一,消防專業證照、特考歷年共錄取521名；  4.近3年學生參加國內外競賽與獲獎共計562件。"
113,私立,技專校院,1069,修平學校財團法人修平科技大學,1214,0,731,209,66.06,"本校前身為臺中「樹德工專」,為工科起家之中部優質學府。民國100年升格科大後更名為「修平科技大學」,培育大臺中地區學子已逾半世紀。本校特色如下：1.培育百工百業人才：本校設有工程學院、管理學院及觀光與創意學院等。無論就基礎工程工業人才建構,科技時代金融服務產業骨幹栽培,新興觀光產業與文化精英涵養等,都能提供各面向教育資源,孕育學生專業知能以注入社會新血能量。2.在職可進修,修習可兼職：本校提供各種學制,除日間部外,另有四技進修部與二技進修部,可於夜間或週六日上課,讓仍需工作者有機會同時進修學業；同時本校是全臺唯一坐落於工業區之科技大學,學生就近兼職機會更多,實為就讀本校之附加利益。3.校外實習累積職場競爭力：本校提供知名大企業實習以增進實務經驗,或者海外實習/研習以拓展國際視野,為學生儲備未來職場不被取代的優勢。"
113,私立,技專校院,1070,長庚學校財團法人長庚科技大學,2183,0,2152,5,98.58,"1.本校辦學績優,深受學生、家長與社會各界肯定：(1)系所通過臺灣評鑑協會教學品保評鑑認證,教學品質備受讚譽。(2)獲《遠見雜誌》2024企業最愛大學生調查、醫療機構最愛大學生第2名；2024臺灣最佳大學排行榜「醫學類」典範大學。(3)113學年全校新生註冊率達98.58%。  2.本校設林口及嘉義校區,「四技」日間部設護理系、幼兒保育系、化妝品應用系、保健營養系；「二技」日間部設護理系、高齡暨健康照護管理系、呼吸照護系、化妝品應用系、幼兒保育系；「二技」進修部設護理系、高齡暨健康照護管理系、幼兒保育系；「研究所」設高齡暨健康照護管理研究所、健康產業科技研究所、幼保系日間部碩士班、護理系日間部碩士班及碩專班。  3.招生專線林口校區03-2118999轉5533(日間部)、5605(進修部)。嘉義校區05-3628800轉2361(日間部)、2371(進修部)。"
113,私立,技專校院,1071,城市學校財團法人臺北城市科技大學,2875,0,1942,658,73.59,"本校辦學特色分為：1.一畢二語三獎四證之教學方針、2.產業導向之務實教學系統及規劃、3.適性揚才：實習職涯發展分流學習、4.拓展提升學生國際視野及移動力、5.培養創新實踐能力、6.型塑品德適性輔導,完善就學協助及7.科技潮流融入實務教學。"
113,私立,技專校院,1072,大華學校財團法人敏實科技大學,310,0,188,285,79.50,"本校校訓為發揚『敏於思、實於行』的精神；四大核心價值觀(正直誠信、相互信任、團隊合作及引領變革)並培育複合型人才培養T型人才之方向,讓師生們積極學習並配合組織需要進行積極自我成長,願意成為主動擔當、積極創新、敏捷實幹、韌性十足之敏實科大成員,為本校的轉型及人才培育盡最大的力量。學校教育目標為：一、培養人工智慧專業技能之技職人才；二、培養服務社會終身學習之技職人才。人才為企業之本,敏實集團攜手敏實科大,形成發展綜效。敏實集團全球資源為敏實科大發展的後盾,有利永續經營。企業集團攜手科大及早培養具有全人素養及企業價值觀與DNA之儲備人才,以減少培訓成本與時間,達到雙贏的結果,發揮企業辦學綜效,支持敏實科技大學,致力朝向於AI人工智慧專業大學發展。"
113,私立,技專校院,1073,醒吾學校財團法人醒吾科技大學,1937,1,1127,365,64.84,"一、本校堅持「實務與證照結合、專業與全人並重」的教育理念,獲得：  1.教育部高教深耕計畫5年3.29億元,109及110年度每年補助均超過6,800萬元。  2.優化技職計畫獲得1,700萬元補助。  3.107-110年陸續獲得教學創新先導計畫、創新創業扎根計畫、教學實踐研究計畫、前瞻人才培育計畫等多項補助。  二、本校各系與300多家企業簽訂合作契約,如：阿里巴巴、伊林娛樂、旺旺中時、三立、東森國際、1111人力銀行、東方文華、君悅、Diamon犇（米其林級）等,達畢業即就業。  三、學生參與各項國內外競賽屢創佳績,107-110年度總計榮獲718項國內外競賽獎項。  四、學校表現獲得各方肯定  1.107年獲教育部「生命教育特色學校」表揚。  2.108年獲得教育部「品德教育特色學校」表揚。  3.109年獲「2020 TCSA臺灣企業永續獎」大學USR永續方案-銅牌2案。"
113,私立,技專校院,1075,文藻學校財團法人文藻外語大學,1658,0,1425,86,86.64,"秉持「尊重個人尊嚴,接受個別差異,激發個人潛能,為生命服務」的教育理念,培育具有「熱愛生命、樂於溝通、服務領導」核心素養的國際觀及專業素養之外語人才。建校至今,外語課程皆以「全外語」授課,培育學生聽說讀寫的能力。此外,碩士班及碩士在職專班提供實務導向課程,教師帶領碩士生與產業界進行專案合作,拓增實務經驗。日四技學生均需修習24個必修英語學分,進四技學生則均需修習16個必修英語學分,以厚實英語能力,增加個人的競爭優勢條件。五專部實施全國唯一的「雙外語課程」,專科部前三年,每位學生必需同時修習兩種外國語文。四技大學部專業課程兼顧理論與實務,且學生可依興趣及就業需求選擇修習學程、雙主修與輔系,以提升其外語能力及專業職能,為職涯做好準備。另為培養學生健全人格,特設立吳甦樂人文學院（含體育教學中心、通識教育中心、吳甦樂教育中心）,培育身心靈整合發展的社會公民。"
113,私立,技專校院,1078,致理學校財團法人致理科技大學,2459,0,2446,149,99.50,"創校60年,辦學績效備受各界肯定,是一所「註冊率高、證照總張數高、學生品德態度高、就業率高、雇主滿意度高」的「五高」學府。本校定位為「培育卓越商務實務人才之創新學習型大學」,設有「商務管理學院」、「商貿外語學院」及「創新設計學院」,3個碩士班及11個系科,「碩士班暨碩士在職專班」、「日間部四技」、「日間部二技」、「日間部五專」、「進修部四技」、「進修部二技」等學制。招收「商業與管理群」、「外語群」、「設計群」、「餐旅群」、「電機電子群」、「資管類」及「家政群生活應用類」相關科系背景之學生,透過特殊選才聯合招生(技職特才組)、申請入學、繁星計畫、技優甄審、甄選入學、聯合登記分發、獨立招生等管道進入本校就讀。培養學生具備商管、資訊、外語及實務應用的能力,推動「校外實習、專業證照、外語檢定、跨域學程、體能認證」五合一教育制度,使學生畢業後符合職場所需,進而提升學生就業競爭力、充分就業、幸福就業。"
113,私立,一般大學,1079,康寧學校財團法人康寧大學,870,0,758,1,87.14,"一、本校學制多元,共有：日間學士班、學士二年制在職專班、二專在職專班及五年制專科班,為一所大健康產業理論與實務結合的教學型大學。  二、位於捷運文湖線葫州站旁,交通便利。  三、設有宿舍提供有需求的學生申請。  四、補助學生海外遊學及國際志工。  五、每年有上百個校內外獎助學金。  六、五年制專科班前三年適用高中職免學費方案。  七、五年制專科班四、五年級可教育部展翅計畫,補助全額學雜費,畢業後保證就業2年。"
113,私立,技專校院,1080,宏國學校財團法人宏國德霖科技大學,1597,0,1059,577,75.25,"本校以培育具備職人精神與公民素養之專業技術人才的大學為培育目標及發展願景,在建立學校特色與口碑方面,致力落實及加強學生專業實務能力,相關具體做法如下：一、強化系實務特色課程教學-加強與業界互動,透過同學參與產學合作案及專題製作,磨練實務技能；辦理業師協同教學及微學程等多元課程,厚植職場見識及建立正確職場工作態度；並加強辦理學生校外實習,以營造系科特色與學生未來就業優勢。二、落實國高中職紮根活動-與上游生源學校進行多樣化接觸,並加強各項合作措施。三、積極開辦各項學程、產業學院及國際產專班,加強培育學生職場技能。四、配合國家產業政策,培育目前國家產業政策需要人才之相關系科,持續推動相關系科檢討畢業生就業定位,進行課程調整,並改善各項軟硬體設施,加強實務教學,使學生學用合一,為國家培養更多相關人才。"
113,私立,技專校院,1082,崇右學校財團法人崇右影藝科技大學,316,0,276,11,87.77,"本校學制有日間部四技與研究所。有三個學院：表演藝術學院、影視設計學院、觀光產業學院,包括7系及1研究所。表演藝術學院：表演藝術系、演藝事業系、影視傳播系、時尚造型設計系；影視設計學院：文化創意研究所、視覺傳達設計系、數位媒體設計系；觀光產業學院：觀光旅遊管理系。本校積極辦學,審度時勢快速創新轉型,教師來自業界比例高為各校少見。與民視公司、廣藝基金會、華研國際音樂等國內大型知名公司產學合作,使得學生畢業後與職場無縫接軌,充分做到名符其實的技職教育,同時本校特別注重學生養成良好態度,培育學生具備技術精熟與態度優良作為進入職場的兩大優勢,並打造職能課程,達成「入學即入行,校園即片場,畢業即就業」之教育目標。歡迎有志青年加入本校,抓住成為人生勝利組的機會。"
113,私立,技專校院,1083,台北海洋學校財團法人台北海洋科技大學,1367,0,964,45,71.46,"本校是一所以「培育海洋技術實務與文化素養專業人才」為宗旨之科技大學,本校為國內唯一擁有獨立教學碼頭並在臺北市與新北市設有校區之私立大專校院。系科規劃五星人才之教育願景,發展一系一特色,發揮各系科之學術研究能量,提供學術研究的行政服務,爭取學術研究資源,開拓各系科發展特色及學術研究水準。規劃跨校、跨系科的整合性研究,並在「專業(智)、忠誠(德)、勤奮(體)、堅毅(美)、服務(群)」的辦學理念下,朝專業、創新、卓越的優質海商學府邁進。"
113,私立,技專校院,1084,亞東學校財團法人亞東科技大學,1068,1,967,156,91.82,"1、強化亞東人特質培育：秉持4C（Creativity、Consideration、Communication、Cooperation）之基本能力培育,積極規劃亞東人優質專業人力培育新模式,落實「證照、專題與實習」的課程內涵,強化通識與英語文教育。 2、發展資通訊、健康照護、紡織產業與創新育成特色：針對環境優勢（亞東醫院、遠東通訊園區、鄰近土城工業區與新北工業區）及同屬遠東關係企業之特質,結合產業應用導向,將研究成果導入課程教學。 3、建構「實務化、資訊化、人文化、創新化、國際化」的發展構面。 4、秉持誠、勤、樸、慎、創新校訓,發揮溝通、合作、創意、關懷理念,建立科技與人文融匯、專業與通識兼顧、理論與實務結合、創新與品質並重之特色。"
113,私立,一般大學,1125,中信學校財團法人中信金融管理學院,323,0,301,9,93.37,"中信金控秉持企業公民理念,善盡企業社會責任,協助提升國內高等教育品質,捐資成立中信金融管理學院,培育國際智慧金融家。本校以「公益為先、助弱扶優」為辦學理念,致力培育「國際智慧金融家」,課程以提升學生「國際移動力」、「智慧科技力」以及「產業實務力」為核心主軸。 透過與優質企業產學合作、績優生就業推薦為本校最重要特色。為落實「助弱扶優」的辦學理念,設立菁英獎助學金爭取及獎勵優秀學生；提供希望獎助學金協助優秀、清寒學生在沒有財務顧慮的情況下,全力完成學業,並持續積極開發各種獎助學金來源,學生在學期間成績達一定標準者即可繼續申請各項獎助學金計畫。以「點一盞燈,照亮一個生命」的公益精神出發,於台南「造一座燈塔,引領青年邁向人生大道」,聚焦「博雅、宏觀、專業、務實」的發展方針,打造為接軌國際潮流的專業金融學院。"
113,私立,技專校院,1168,南亞科技學校財團法人南亞技術學院,922,0,688,0,74.62,"本校多元科系及優質設備與師資,提供學生適性選擇及良好的學習環境。因應國家募兵政策,本校積極配合國防部推動ROTC(大學儲備軍官訓練團),並成為全國唯一且成效第一的「國防部ROTC專業大學」。本校結合國防部資源提供ROTC學生四年免學雜費及住宿費,每月再給優渥的生活費。讓學生享有大學生的自主校園生活,並接受軍事課程訓練,畢業後不僅取得雙專長及大學學歷更可任職軍官。本校結合國防部在各高中職設立國防培育班,在各高中職推廣ROTC,並推出菁英專案提供更完善的照顧給予優質的學生。本校也積極與各企業合作,共同推出在職專班,讓學生同時取得大學學歷,也搶先提升職場競爭力。近年與各軍團簽訂策略聯盟,合作關係密切,開設營區專班或證照班,積極鼓勵國軍在營進修,就讀本校進修部四技、二技、二專、或參加推廣教育證照班。"
113,私立,技專校院,1183,黎明技術學院,1629,0,1019,440,70.52,"配合專業特色之運作需求,本校計招收有4大學群12系科、1研究所,其中「工程服務學群」包括機械工程系、電機工程系、車輛工程系、織品管理研究所等3系1所；「觀光餐旅學群」包括觀光休閒系與餐飲管理系2系；「時尚創意學群」包括數位多媒體系、服飾設計系、化妝品應用系、數位行銷管理系等4系；「演藝影視學群」包括表演藝術系、影視傳播系、戲劇系等3系。近年雖遭逢少子化衝擊,本校因系科規劃及專業特色尚獲肯定,招生率均可維持逐年成長,目前日間及進修學制學生合計約5千人。 <br> 近年各系均致力於實用課程規劃、專業教室建置、擴大校外實習、產學合作夥伴招攬及教學活動安排,藉以提升教學資源運用並增進學習效能。近年學校獲董事會大幅挹注,校園環境煥然一新,並積極建置、更新各系所需之專業教學空間,充分達到務實學習、無縫接軌產業之校務發展目標。"
113,私立,技專校院,1185,德育學校財團法人德育護理健康學院,1189,0,718,154,64.93,"本校校務發展規劃秉持創辦人辦學理念,學校發展願景（核心價值）、學校定位等,積極在教學上,培養學生未來具「三照兩證」（外語、資訊與專業證照,以及游泳與CPR）,同時掌握「創新．精準．關懷．永續」的內涵,持續為國家社會發展培育具實作技能的優秀人才。因此,「培養具實務技能人才」、「實踐在地與永續發展責任」、「發掘弱勢需求與強化學生輔導」、「推動國際交流與雙語教育 」、「積極國際交流」、「發展學校優勢特色」、「落實校務研究與資安機制 」為本校持續推動之發展重點。本校致力於學生能夠安心就學、實習與自主學習,推動扶助經濟與文化不利學生,發展學校優勢,注重全人教育,推動國際交流與外籍生就讀等,並依據本校定位「一所Care學生學習的健康學院」,整合本校發展重點。"
