學年度,設立別,學校類別,學校統計處代碼,學校名稱,當學年度全校總量內核定新生招生名額(A),當學年度全校新生保留入學資格人數(B),當學年度全校總量內新生招生核定名額之實際註冊人數(C),當學年度全校境外(新生)學生實際註冊人數(D),當學年度全校新生註冊率(％)E=〔(C+D)/(A-B+D)〕*100％,當學年度全校招生特色說明
113,公立,一般大學,0001,國立政治大學,4158,9,4030,321,97.34,"本校是臺灣最具人文與社會科學特色之綜合大學,致力於國際化及多元文化環境下,以培育具備跨領域多元知能、兼具本土扎根與國際視野的人才為重要使命。2023年遠見雜誌企業最愛大學排行榜,本校名列第7名,2023年亞洲大學QS排名,本校再入百大且仍為國際交換生首選。本校推動低門檻修習雙輔修措施,另有學分學程、選修外系課程與ETP全英語課程供學生自主選修；與陽明大學、臺北藝術大學,簽訂學術合作,提供校際選課；2021年加入台聯大系統,與陽明交通大學、清華大學及中央大學整合資源,提供學生跨校選課及圖書資源。本校與全球 500 餘所知名大學簽署超過 800 多項合作協議,遍及五大洲,並鼓勵師生出國交換進修及打造多語學習環境,本校全球傑出校友超過 10 萬人,於政府部門、企業界或藝術媒體界皆位居牛耳並具重要社會影響。"
113,公立,一般大學,0002,國立清華大學,4698,43,4694,438,100.00,"一、本校設有各類獎學金,特色獎學金如：還願獎學金、逐夢獎學金,兩者申請皆金額不限,申請不需成績優異、不限申請次數。二、本校致力開發多種跨領域學習課程,設30多個跨院系學分學程,提供更為多元化及客制化學習機會。三、本校在多項學術指標如：國內大學學術聲譽排名、理工學院聲譽排名、最佳研究所排名、國內企業最愛的大學生等評比上均名列前茅,為國內頂尖學府。2018年英國QS世界大學排名,本校躍升至161名,其排名各項指標表現為全國數一數二之成績。四、本校提供新生各管道入學之低收、中低收及特殊境遇家庭子女「旭日獎學金」,入學後得依相關要點提出申請,經審議通過後核發,獎學金每年申請一次,最多四年。五、本校致力推動全球化,目前本校簽有學術合作合約之大學／學術機構共計有220多所。在雙聯學位部分,本校有與瑞典林雪平大學、香港科技大學、大陸北京清華大學及英國利物浦大學等世界多所知名大學合作且陸續增加中。"
113,公立,一般大學,0003,國立臺灣大學,8704,14,8647,752,99.54,"本校目前有17個學院(含進修推廣學院、共同教育中心、重點科技研究學院、國際政經學院及2功能性學院),以及牙醫、藥學、獸醫3個專業學院,計有61學系(含5學士學位學程),152研究所(含39碩博學位學程),另設約50個各學術領域之國際級、國家級與校級研究中心,是臺灣規模最大的綜合性大學。學生總人數已達3萬4千餘人,其中學士班1萬7千餘人,研究生1萬6千餘人,比例接近一比一。各學院提供完整的知識地圖、豐富的圖書資源、先進的科技設備、暢通的學術鏈結,結合優美的校園環境,共同形成具有吸引力的教學研究環境。本校透過完整的學科領域與豐富多元的學術資源與設施,更鼓勵學生跨領域學習以開拓視野並具備終身學習的知能,在校際拓展姊妹校網絡及雙聯學位合作,並加強建構雙語教學環境。本校除了展現卓越的學術研究成果,也持續讓教學研究單位評鑑、教師評鑑、課程評鑑等制度與時俱進,務使學生能在最佳的環境學習成長。"
113,公立,一般大學,0004,國立臺灣師範大學,4211,52,3982,450,96.16,"本校為綜合型大學,提供國際化、跨領域、社會關懷及科技人文藝術整合的學習環境,將邁向「亞洲頂大」及「國際卓越」的大學。  2024年QS世界大學學科排名,共12個學科入榜,教育及運動2個學科進入全球前百名並名列全國第1,教育學科獲評為全球第27名,並在U.S. News & World Report教育及教育研究學科排名中名列全球第7名；另本校與國際知名大學建立合作關係,現有超過400所姊妹校,每年提供1千個交換機會遍及全球。  2024年本校榮獲教育部認證雙語標竿大學之一,校內成立「雙語教育推動辦公室」及「英文學術素養中心」推動單位,培養學生的專業英語能力。  本校鼓勵學生跨域學習,提供雙主修、輔系、學分學程、出國交換及修雙聯學位等學習機會；更與臺灣大學、臺灣科技大學成立「國立臺灣大學系統」,讓三校學生可以跨校選課及互修學程。每學期達4千人次以上進行跨域學習,培養學生多元跨域整合人才。"
113,公立,一般大學,0005,國立成功大學,6476,16,6488,416,100.00,"本校秉持「窮理致知」校訓,豐厚累積產業及國家經濟發展所需的專業人才,因此素有「企業最愛大學」封號。除了人社、理工、生醫等深廣專業學術課程外,成大亦開創多元彈性的學習制度及模式,導入議題導向及終身學習,培養未來所需的跨域實踐能力及素養,全方位支持學生學習,並積極回應從在地到國際的全方位人才需求。推動交換學生計畫及跨國雙學位合作計畫,致力營造跨越界限的在地國際化世界校園,使學生透過參與海外交換學生、移地教學、短期研究實習、國際學生接待義工、國際工作營、論壇及志工等校內外國際化課程與措施,除追求專業知識能力,同時建立在地文化的自我認同並延伸至全球意識課題,涉獵多元文化,涵養自身競爭力,與國際接軌。"
113,公立,一般大學,0006,國立中興大學,4529,0,4421,216,97.72,"國立中興大學創校已逾百年,培育出無數傑出人才,為國內歷史悠久、根基深厚且師資優秀的綜合型大學,且是中台灣唯一頂尖大學,在農業科學、植物與動物科學、工程、材料科學、電腦科學、化學、生物與生化、臨床醫學、環境/生態學、藥理學與毒理學、一般社會科學11大領域,名列基本科學指標（ESI）全球前1%。本校設有文、農業暨自然資源、理、工、生命科學、獸醫、管理、法政、電資和醫學院等十大學院,另設有循環經濟研究學院,以及提供給社會人士進修的創新產業暨國際學院。研究中心包含生物科技發展中心、前瞻理工科技研究中心、人文社會科學前瞻研究中心、環境保育暨防災科技研究中心、先端產業暨精密製程中心、產學研鏈結中心等中心。除校本部外,另有中興新村南投分部,以及總面積達8千餘公頃之惠蓀、新化、東勢、文山等4大實驗林場、獸醫醫院、農業及動物試驗場等教學研究設施。"
113,公立,一般大學,0007,國立陽明交通大學,5653,15,5746,278,100.00,"國立陽明交通大學為國立陽明大學與國立交通大學於2021年2月1日合併成立。此兩所臺灣頂尖的生物醫學大學及電資理工大學合而為一,被喻為強強聯手,遠見雜誌於2021年評比為「未來十年最具潛力的大學」。陽明校區作為醫學教育改革的先驅者,紮實培育新世代醫牙藥護、生命科學、生醫工程、醫學人文等專業與尖端研究領域之優秀人才,在高齡長照、腫瘤、腦科學、醫學工程等已有深厚基礎,在全球醫療領域有領先地位,和臺北榮民總醫院長期合作,位於宜蘭的附設醫院也積極挑戰成為全方位的醫學中心。交大校區在電子、資通訊與管理、科學與工程等領域為台灣領導者,為台灣半導體及科技產業培養優秀人才,並以發展生醫領域為目標,包含生醫資訊、生醫材料、生醫電子等,期能橫跨電資通訊與生醫,為我國開拓生醫科技產業之先驅。合校後「一樹百穫計畫」,除更新與活化校區外,更因應人工智慧時代對研發人才迫切需要,在智慧醫療與電子工程上為世界開啟嶄新篇章。"
113,公立,一般大學,0008,國立中央大學,3792,6,3844,125,100.00,"中央大學設有文、理、工、管理、資訊電機、地球科學、客家、生醫理工、研究學院,共9個學院,大學部23個系、6個院設班別；55個研究所、18個獨立所、12個學位學程,是一所科學、人文薈萃的綜合大學。目前學生人數約12,000人,大學生與研究生比例約1：1。  在教學特色與學習資源方面,推動跨域學習與自主學習,並建立數位學習平台,並設有雙聯學位、交換學生計畫、語言文化課程、海外暑期實習等,以培養學生國際移動力,以及與清華大學、陽明交通大學、政治大學共組台灣聯合大學系統,整合教育、研究、行政及圖儀等豐富多元的教學資源。  在生活及助學方面,以「學習取代工讀」為宗旨,設立安心就學支持計畫,設有向日葵助學金、安心學習助學金與多項學習獎勵金,另每學期提供約有150項校內外獎助學金可申請,並設有一對一課輔、各系課後輔導等個別化課業輔導,以及導師晤談、宿舍導師等生活關懷措施。"
113,公立,一般大學,0009,國立中山大學,3275,12,3069,188,94.38,"國立中山大學位於高雄港灣,憑藉「山海合一」的地理優勢與「國際化的校園氛圍」吸引全球多元背景的學生就讀。作為高屏地區的頂尖研究型大學,中山大學以跨領域學習為核心,重視全人教育、創新教學及SDGs目標。透過繁星、南星、西灣南星及特殊選才等招生管道,拓展經濟或文化不利學生的入學機會,並提供經濟支持與個性化學習輔導,以培育具全球視野的專業人才。    中山大學設有豐富的跨領域課程與專業學位學程,提升學生的國際移動力。作為教育部雙語重點培育大學,本校積極推動雙語教學,培養學生英文能力並鼓勵參與國際交流,拓展國際網絡。同時,設有國際金融、半導體及重點科技研究學院,並連結在地及國際產業,建立國際合作研究平台,為產學合作注入動力。未來,中山大學將秉持「藝文與包容、前瞻與創新」的願景,致力成為南臺灣的知識創意引擎,培育具前瞻思維的領袖,推動南台灣產業、學術及文化發展,邁向國際頂尖大學的目標。"
113,公立,一般大學,0012,國立臺灣海洋大學,2623,3,2316,156,89.05,"本校位於大臺北地區之基隆市,有獨特的龍崗生態園區與雨水公園,學術氛圍、生活機能與學習環境極優。本校設有7個學院、22個學系、16個獨立研究所、31個碩士班、19個博士班、14個碩士在職專班、3個進修學士班與師培中心,另設有商船及輪機學士後多元專長培力課程專班。海洋的領域浩瀚,本校不論是海洋海事水產、海洋工程（如離岸風電）、航運管理、輪機造船、海洋觀光休閒與文創、海洋探勘與考古、海洋生物、環境保育以及海洋法律等,從科技到人文領域,本校都有足夠資源,讓同學成為各個海洋專業領域的翹楚。本校辦學績優,不僅獲Cheers雜誌評選為「TOP30」企業最愛大學畢業生,2024年英國泰晤士高等教育（THE）世界大學排名全球801至1000區間、2023年世界大學綜合排名全國第12名,也連續榮獲教育部「高等教育深耕計畫」經費補助,為全球最具完整海洋特色且大學排名最前面之「國際化的頂尖海洋高等學府」。"
113,公立,一般大學,0013,國立中正大學,3404,2,3186,90,93.81,"本校以「新世代、新思維、新定位」為核心概念,培養學生思考能力、生活能力、運用資訊/媒體與科技能力、工作能力四個終身受用的關鍵能力,期許透過多元招生方式,結合教育部推動「適性揚才」理念且兼顧學系適性選才和多元指標的選才管道,擇選具有高學習熱忱及對學系有認同感之學生,使其能在符合興趣環境下自主學習,並提供不同背景、區域的學生就讀機會,促進學生組成多元化,拓展學生視野,為國家培育具職涯競爭力及國際移動力的跨領域優質人才。作為雲嘉地區指標性的綜合型大學,本校擁有文、理、社科、工、管理、法、教育等7個學院,以及前瞻製造、高齡研究、國家政策研究、奈米生物檢測等4個特色研究中心是進行跨領域學習的沃土。因此,本校透過建構適性揚才、多元拔尖的招生選才機制,展現大學應有的社會責任,讓在特殊領域有優秀表現的學生,不受現行招生管道限制,也讓經濟弱勢、原住民、新住民子女有更多入學機會,呈現出本校多元招生特色。"
113,公立,一般大學,0014,國立高雄師範大學,1946,0,1741,35,89.65,"一、定期製作校務成果簡報展現師生優質表現,設置媒體專區提升校務治理成效之能見度,爭取利害關係人之認同,提升學校聲譽,獲得社會大眾瞭解與肯定。二、重視與各招生管道的連結,學士班強化與高中端交流,積極到各高中宣傳,亦主動針對高中生書審資料及面試準備提供諮詢建議,以提高對本校的認同與辦學信心。碩、博士班招生除了至各公私立大學、補習班、產學界、社區積極宣傳,更積極辦理招生說明會、經營網路社群平台與粉絲團；定期舉辦校友聯誼,透過校友團隊力量為本校爭取更多潛在生源。三、為落實扶助弱勢的高教公共性精神,除開設原住民專班,並積極於招生場域宣導弱勢助學措施、透過入學管道優先錄取弱勢學生、報名費優待等,具體強化弱勢助學措施。四、針對國際生,積極參加越南、港、澳等地教育展,南向進行馬來亞西、印尼、印度、泰國之招生拓點計畫,並以獎學金、學雜費減免或住宿費減免、企業實習、全英授課及博士班招生等,吸引外國學生就讀。"
113,公立,一般大學,0015,國立彰化師範大學,2399,0,2295,64,95.78,"本校除了建立師範菁英教育體系及培育優秀中學師資之外,更均衡發展七個學院,創造多元豐富之學術領域,且在人文社會與科技產業各層面積極發揮影響力。本校以優質的師資、設備與適性的學術氛圍,致力啟發學生潛能並培育多元專業能力,使其成為國家中堅人才。為了打造優質的大學校園,近年來積極進行校園之軟硬體建設,讓學生能在優質校園環境的薰陶下,徜徉於自由學術園地,建立專業與自信,為未來的圓滿人生奠立良好基礎。本校除了注重培育學生兼具品德與跨領域的專業素養之外,更積極形塑人文與科技並重的校園文化,在追求知識與體能均衡發展的同時,兼顧傳統與創新,以及生命的關懷與圓滿。未來亦將持續秉持「務實、行動、效能」之精神,致力於校園建設,以培養學生的專業能力與品德為最高之教育願景！"
113,公立,一般大學,0017,國立臺北大學,2633,0,2483,181,94.67,"本校創立於1949年,歷經臺灣省立地方行政專科學校、省立法商學院、中興大學法商學院等階段,2000年,全新的「國立臺北大學」正式成立。承載過往知名的法、商優良傳統,加入了人文、電機資訊等學科後,現在的臺北大學是一所以學生為本位、朝向研究與教學並重的綜合型大學。回顧過去,本校培育了於十萬校友,遍布各公私部門,在各領域都有傑出的表現,不僅是臺灣經濟與社會發展重要的堅石,帶著臺灣經驗,進軍世界各地,也都創造了卓越的成就。本校的教育目標要培養兼具跨界專業核心能力、人文社會關懷、現代科技素養以及國際移動力的世界公民。本校促進跨校資源整合,與北科大、北醫及海洋大學共組「臺北聯合大學系統」,師生得以共享四校教學與圖書資源,拓展學習廣度和視野。本校亦與世界各地知名大學合作,協助學生在校期間就能累積世界移動能量。本校致力建立與在地社區、組織、機構的緊密鏈結管道和合作關係,善盡大學社會責任,促進社會共融。"
113,公立,一般大學,0018,國立嘉義大學,3439,24,2945,55,86.46,"有關本校招生特色說明,請詳見本校招生資訊網頁https://website.ncyu.edu.tw/admission"
113,公立,一般大學,0019,國立高雄大學,1576,3,1483,56,94.48,"一、擁有自由的學術研究環境,培育視野遼闊且具人文與科學素養的學生。教學單位設有人文社會科學院、法學院、管理學院、理學院、工學院等五大學院,以卓越教學自我期許作育英才。 二、強調「創新」、「新穎」及「特色」的系所,課程則著重「理論」與「實務」相結合的「應用」面,推展「全人教育」理念,提倡全方位學習的「成人」教育。設計核心學程及整合學程,並以「專業化的師資」、「科技化的設施」與「多元化的制度」提昇高等教育水準,邁向國際一流之卓越大學。 三、本校為新成立的大學,圖儀設備新穎、教學成果卓越、學術研究輝煌,每年除了聘任年輕師資(平均年齡約42歲)及廣辦各式學術交流與研討活動外,熱情友善的職員工以高效率之行政,輔以高科技設施及電子化流程服務全校師生,讓師生在多元、科技、舒適的環境中授課及學習,以期培育學生成為全球頂尖之菁英。"
113,公立,一般大學,0020,國立東華大學,2598,24,2228,234,87.68,"本校目前有人文社會科學學院、理工學院、管理學院、原住民民族學院、花師教育學院、藝術學院、環境暨海洋學院及洄瀾學院等八大學院,涵蓋領域廣泛,並且擁有學士班、碩士班、碩士在職專班及博士班完整學制,提供學生學習深度、廣度的機會及空間。在資訊科技瞬息萬變、國際情勢牽一髮動全局的新世紀,物流趨向、經濟管理已朝全球運籌方向發展,自然資源的維護與管理亦是刻不容緩,東華不但以永續經營的理念、資源整合的方式培養具有國際視野的人才,也結合地方特色、研究在地產業,舉凡石材、生物科技、電腦軟體、港區產業、觀光休閒以及東部人力資源等,兼具地域特性與時代趨勢的研究方向,正是東華躋身國際學術主流的籌碼。"
113,公立,一般大學,0021,國立暨南國際大學,1568,0,1432,119,91.94,"國立暨南國際大學位於臺灣地理中心南投縣埔里鎮,四周層巒疊翠視野開闊,校地面積150公頃,國道六號通車往返學校便捷。目前設有人文、教育、管理、科技、水沙連及護理暨健康福祉等6學院,計有25個學士班（組）、28個碩士班（組）、7個碩士在職專班、15個博士班（組）。本校設校時訂定強化人才培育、增進僑教功能平衡區域發展、推廣國際交流為發展目標。設校之初,優先設置東南亞研究中心,積極推展僑教任務與國際交流,打造國際化大學特色;嗣後積極省思大學在地社會責任,期望藉由扮演地方公共智庫與人才培育孵化器兩種角色,輔以社會參與式教學與行動研究設計,連結在地城鎮的公共社群,協力發展共學共工的水沙連大學城。 目前發展重點特色：1.配合在地發展需求,設置相關專業系所。2.以培養社會實踐人才為目標,規劃跨領域特色學程。3.設置特色研究中心,開展各項社會實踐行動研究方案。4.滾動式制度修正,建構大學社會責任的支持系統。"
113,公立,技專校院,0022,國立臺灣科技大學,2930,3,3013,332,100.00,"本校四技對外招生之系組包含機械工程系、材料科學與工程系、營建工程系、化學工程系、電子工程系、電機工程系、資訊工程系、工業管理系、企業管理系、資訊管理系、設計系工業設計組、設計系商業設計組、建築系、應用外語系及全球發展工程學士學位學程等。本校師生近年來在國際上各項排名,均有傑出表現,舉凡英國QS高等教育機構世界最佳大學、英國泰晤士報全球最佳大學、德國iF及紅點設計獎、英國TIMES世界大學領域排名(社會科學領域)、英國QS全球學科前兩百大最佳排行等。另外,各系所畢業校友畢業出路包含出國繼續深造、國內深造以及投身於產業界。由於實作經驗豐富,理論基礎完備,工作態度認真,畢業校友擔任政府要職、大學教授及企業主管者眾多,深受肯定。"
113,公立,技專校院,0023,國立雲林科技大學,2787,0,2601,92,93.54,"本校以「創新教學與產業對接為特色的國際知名大學」為發展願景,秉持「誠敬恆新」之校訓精神,為社會與產業培育人才。YunTech以師生的發展對接經濟、環境、社會永續發展需求、為地方與全球福祉做出卓著貢獻、塑造創新、智慧、友善、永續的校園、以及名列亞洲百大、世界千大為目標；並以五化為策略：(1)特色化：創造對接場域的教學與研發特色,(2)學術化：瞄準產、學應用的基礎研究,(3)產學化：加值產業與教學創新的產學合作,(4)國際化：吸引優秀國際師生加入教學與研發團隊,(5)精準化：校務數位轉型與精準教育。本校現有四技（含進修）、二技、碩士（含在職）、博士班學制,提供多元入學管道,並提供多項助學方案,設置獎助學金、入學優異獎學金、校外競賽傑出表現及證照獎勵金等照顧學生方案。本校積極爭取產業界及政府資源挹注,發揮強大的產學研發實力與學術研究能力,讓師生成就被世界看見與發光！"
113,公立,技專校院,0024,國立屏東科技大學,2633,11,2182,109,83.89,"1、全人化－透過課程的教學以及無形的陶冶與溫馨的關懷,健全人格發展,使學生不僅是具有工作能力的專業化,也是兼具社會責任的社會人與富有人文關懷的文化人。<br> 2、專業化－掌握人力市場資訊,培養學生具有紮實的工作能力、學習能力與創造能力,以符職場需求,或從事科技研發與經營管理,以促進國家產業升級。<br> 3、國際化－因應國際化趨勢,培育學生立足地球村應有的素質,強化國際語文能力,增進對國際社會的認識,瞭解國際政經的發展,提升學生國際競爭力。"
113,公立,技專校院,0025,國立臺北科技大學,3207,3,3270,284,100.00,"北科大創立於民國元年,與國同壽,畢業校友十餘萬人,培育無數臺灣各階段經濟發展關鍵產業之技術人力,臺灣上市、上櫃公司主要負責人有10%以上為本校校友,素有「企業家的搖籃」的美稱,深獲社會好評。111年Cheers企業最愛大學調查名列技職第1、111年度獲1111人力銀行全臺公立科技校院第2名。  北科大實施校外實習及程式設計相關課程必修,亦配合國家產業發展設立主題式跨領域或新興領域學程提供學生修習,與臺積電等龍頭企業合作開辦產業鏈結學程,合作企業提供實習機會,完成學程同學獲得優先面試與較高起薪之待遇。本校並為「臺北聯合大學系統」成員,北大、北醫及海大提供跨校選課、輔系、雙主修、學期交換等多元跨域學習,同學可享受四校資源及共同課程。"
113,公立,一般大學,0028,國立臺北藝術大學,747,1,726,56,97.51,"本校成立於1982年,當時名為「國立藝術學院」,2001年改名為「國立臺北藝術大學」,目前設有音樂、美術、戲劇、舞蹈、電影與新媒體、文化資源、人文等7個學院,10個學系/學程、19個碩士班、4個碩士在職專班、5個博士班,以及通識暨共同教育委員會。  作為台灣最重要的藝術人才孕育場域,北藝大宗旨為「兼顧傳統與現代、國際與本土並進」,培育藝術創作、展演及學術研究人才,以創造藝術發展之新契機。在設備上,北藝大除了擁有一座藝術資料完整的圖書館之外,也是全台灣目前唯一擁有自己的專業音樂廳、戲劇廳、舞蹈廳、美術館與電影院的大學學府。本校也持續進行國際交流,與世界各國藝術教育接軌,並與一流藝術校院締結姊妹校,使本校成為高度國際化之專業藝術學府。"
113,公立,一般大學,0029,國立臺灣藝術大學,1382,4,1257,55,91.56,本校博士班學制包含六大班/系所(組)、碩士班學制包含二十班/系所(組)、碩士在職專班學制包含十三班/系所(組)、學士班學制包含十五學系(學程)、進修學士班學制包含十一學系、二年制在職專班學制包含六學系。
113,公立,一般大學,0030,國立臺東大學,1490,17,1289,9,87.58,"國立臺東大學創立於民國37年,早期為一所以培育國小師資為主之師範學院；民國92年8月1日改制並更名為「國立臺東大學」,除原本的師範學院外,再增設人文學院及理工學院,成為一所綜合型大學；民國103年,隨著本校知本校區落成啟用,各學院全數遷至知本校區(即校本部),以發展學術研究及教學活動為主,而臺東校區則規劃為產學營運、推廣教育暨各類特色中心,帶動地方發展。 本校設有師範、人文及理工學院,教學及研究範疇包含教育、語文、社會、人文、運動、藝術、資通訊及數理等各種領域,招收大學部、研究所及進修學制等學生,學生數約為5千人,是一所溫暖精緻、師生關係融洽的教學型大學。"
