113,公立,一般大學,0031,國立宜蘭大學,1456,2,1387,22,95.46,"★本校榮獲泰晤士報高等教育特刊THE「2024年全球影響力大學」排名全國前30%及英國高等教育調查機構QS「2024 亞洲大學」排名全國前25%,獲國際肯定。  ★校區位於宜蘭市中心,交通便捷、生活便利,另有城南校區、大礁溪林場、五結校區、金六結農場、南澳農場等多元教學場域,提供專業跨領域課程,厚植人工智慧、綠色科技、精準健康、高齡產業、智慧農業等技術。  ★教育部人工智慧學程大學聯盟(TAICA)夥伴學校,串聯國內頂尖大學AI課程與師資,成為東部AI發展核心基地。  ★連續榮獲教育部獎勵大學教學卓越計畫及高等教育深耕計畫肯定補助。  ★工學院及電機資訊學院各學系皆通過IEET認證,畢業學歷受國際認可。  ★全球72所海外姊妹校,提供多項國際雙聯學制,全球學習管道暢通無虞。  ★校外134間實習機構,結合校園與企業資源,透過企業夥伴人才培育及就業輔導,順利銜接職場。"
113,公立,一般大學,0032,國立聯合大學,2053,3,1832,28,89.51,"現有「理工學院」、「電機資訊學院」、「管理學院」、「客家研究學院」、「人文與社會學院」及「設計學院」,包含19個學系(含15個碩士班)、2個學位學程、1個在職專班、1個獨立研究所、1個原住民專班、1個博士學位學程、1個博士班。本校針對「在地文化」、「優質教學」、「研究創新」及「社會服務」四大願景進行規劃,積極推動跨領域人才培訓,擴大產、學、研人工智慧策略聯盟,強化學生產學實習與就業能力,拓展國際移動力,鍛造出就業競爭力。"
113,公立,技專校院,0033,國立虎尾科技大學,3238,0,3054,37,94.38,"虎尾科大以發展泛機械群工程技術領域創校,在精密機械、光機電整合、資通訊應用、綠能與節能、生物科技、以及精緻農業等工程領域,已發展為極具創新研發能量的「工程技術型科技大學」。本校深耕精密機械領域,為國內智慧機械發展重點培育學校,並以「邁向具有重點特色的精緻型卓越科技大學」為目標,建置智能機械與智慧製造研究中心與國立唯一航空維修中心。107年榮獲教育部高等教育深耕計畫經費補助並為全國科大第三名,更於108年工程教育認證獲得最優佳績；112-116年第二期持續於112年獲得補助金額2億4150萬元並為全國科大第四名。為深化實務教育與產業鏈結,擘劃創新產學校園,擬定五大發展面向,期能落實智慧校園、智慧學習,鞏固虎尾科大產學研優勢並善盡社會責任。因應多元化之社會發展,積極打造「創新產學校園」,攜手企業育才、共同成長。"
113,公立,一般大學,0035,國立臺南藝術大學,416,0,372,4,89.52,"本校為一藝術專業大學,「修藝進德,臻於卓越」為學校發展願景。在校長帶領下秉持「藝術承傳、守護、轉化、創新」之使命感,以「藝術擴張、跨域、實驗、連結」的策略發展校務,致力營造提昇美感教育、啟發創造力及融合藝術於生活之優質學習環境,使師生在自由、自在及自信的學風中,成為志道、據德、依仁、游藝之人文藝術專才。同時以「兼重在地特色與國際視野之藝術教育」、「培養兼具傳統素養與創新能力之藝術人才」、「強調融合創造力與應用力之藝術內涵」、「營造整合校園與周邊區域之藝術聚落」以及「建構全藝術交流與科藝整合之元宇宙空間」五大發展目標為基礎,擬訂校務發展計畫行動,盼能將科技與藝術跨領域結合,並以師生藝術創作、展演、研究及教育推廣之力量來關懷生命、服務社會,讓藝術之光度與強度在生活中自然發生,最終達成本校願景。"
113,公立,一般大學,0036,國立臺南大學,1719,1,1561,16,90.95,"國立臺南大學是南臺灣唯一百年綜合大學,創校至今118年,秉持傳統品德素養,志在培育具備「仁智誠正」之專業人才,經歷師專、師院改制,並於民國93年正式轉型為綜合大學,符應社會趨勢,不斷創新,陸續創立教育、人文與社會、藝術、理工、環境與生態、管理等6大學院21個學系,另設有25個碩士班、6個博士班,16個碩士在職專班。提供專業領域人才繼續深造之優良學習環境。本校立基臺南,以深耕在地,邁向國際為發展願景。除持續培育學生基本能力外,因應產業人才需求,與地區性產業進行產學合作,打造府城在地化特色大學。"
113,公立,一般大學,0037,國立臺北教育大學,1607,6,1532,50,95.82,"3個學院(教育學院、人文藝術學院、理學院)16個學系、24個碩士班、3個學位學程及5個博士班,深耕教育專業技能培能人才無數,榮獲教育部核定師資培育公費生,設有卓越師資獎學金培育小學、幼教、特教師資。教育學院文教法律、課程教學及心理諮商師的重要搖籃,栽培出全臺最多小學校長、教師；人文藝術學院深耕人文專業、滋養藝術設計與創意氛圍,培養出具備多元思辨與美感藝術與文創人才。理學院領航數學教育、科學教育,發展數位學習、AI、玩具遊戲設計和運動休閒產業,成為培育產學合作的重要生力軍。  畢業就業率歷年均高達96%以上/2021臺灣最佳大學排行榜文法商大學名列前15名/2021-2023進入英國高等教育調查QS大學排行榜「亞洲最佳大學前500大」/2022天下USR大學公民調查排行榜第四名/2021年臺灣最佳大學排行榜文法商大學名列前11強/111年第九屆教育部藝術教育貢獻獎大專組「績優學校獎」"
113,公立,一般大學,0039,國立臺中教育大學,1358,0,1318,33,97.12,"本校創建於1899年,融合百年師資培育之社會楷模理念、博雅專業理想與教育專業特色,已發展「教育學院」、「人文學院」、「理學院」及「管理學院」四個學院,是一所兼具文理藝術特色、教育研究專業、師資培育功能及產業創新發展人才培育的精緻大學。秉持「承百年師範,立未來教大」治校理念,因應社會環境變遷及全球化的挑戰,本校持續透過課程規劃,提升學生跨領域、雙語、量化分析及數位能力；運用數位化教學設備及社群共學合作,促進學生自主學習及教師教學研究能力；在教學面導入業界出題師生解題合作機制,彌縫學用落差並活化教學內容；在學生學習面,除鏈結在地區域需求鼓勵社會參與,培養人文關懷素養外,也積極擴展國際交流,提供交換生、雙聯學制、海外志工及實習等機會,開拓國際視野。本校透過課程學習與非課程活動薰陶,提升語言溝通、數位素養、量化分析、自主學習、問題解決的能力,培養能掌握社會脈動及運用科技工具的新世代師資與專業人才。"
113,公立,技專校院,0042,國立澎湖科技大學,761,0,498,2,65.53,"本校未來中長程校務發展目標旨在建構「島嶼產業應用型科技大學」,以澎湖離島特性,配合在地特色產業,以觀光遊憩、海洋水產及綠色能源為發展主軸,積極推動水產養殖、食品加工與安全、觀光休閒、海洋遊憩與綠能相關教學、研發與產學合作,並導入外來資源,以協助澎湖地方產業、經濟與文化之提升,強化學生專業學習與實務之連結,精進學生就業競爭力,以培育優質產業經營實務人才,並帶動地方繁榮與發展。"
113,公立,技專校院,0043,國立勤益科技大學,3172,5,2712,339,87.02,"一、本校學制包括：日間部(博士班、碩士班、產業碩士專班、四技、二技)、進修部(碩士在職專班、四技、二專、二技)。本校設置有工程、電資、管理、人文創意、通識教育等5個學院,系所包括：機械工程系、化工與材料工程系、冷凍空調與能源系(環境控制組、能源應用組)、智慧自動化工程系、電機工程系、電子工程系(綠能晶片與系統應用組、網路多媒體暨遊戲機組、智慧電子產品設計組)、資訊工程系、人工智慧應用工程系、工業工程與管理系、企業管理系、資訊管理系、流通管理系、健康產業科技研發與管理系、文化創意事業系、景觀系、應用英語系等。二、本校以「務實致用創新導向之優質產業科技大學」為發展願景,以「產業人才培育的搖籃」及「技術研發的基地」為發展目標,肩負科技校院培育優質技術人才的使命,善盡國立大學社會責任,促進學校永續經營與發展,以創新面對挑戰,永續學校發展。配合國家政策及產業人才需求,培育為社會所用之專業技術人才。"
113,公立,一般大學,0044,國立體育大學,637,0,633,11,99.38,"國立體育大學為亞洲頂尖、世界一流的體育高等學府,規劃了優質的教學環境,有行政教學區、運動訓練競賽區、生活住宿區、運動休閒區及戶外遊憩區等,並具備國際標準的運動設施、擁有國際知名的專業師資及挹注豐沛的教學、研究等資源,課程重視學用合一,就業管道多元,為培養體育運動優質人才的搖籃,使本校學生在國際體壇或學術表現出類拔萃、成績優異成為臺灣之光。 辦理姊妹校師生互訪交流、交換學生及雙聯學位計畫、海外實習與學海計畫及國際文化活動,提供更多元的學習與文化交流機會,拓展本校學生國際視野、強化實務能力、國際觀點及競爭力。 校園有體育館、游泳池、網球館、室外籃球場、射箭、射擊場、羽球館、跆拳道館、體操館、低氧艙實驗室、舉重館、田徑場、柔道場、10公尺空氣槍射擊場、肌力體能訓練場、棒球場、田徑場、戶外冒險體驗教育場、圖書館、博物館、運動防護中心、體適能中心等,提供學生多元安全的學習、運動及休憩環境。"
113,公立,技專校院,0046,國立臺北護理健康大學,1518,2,1396,41,92.29,"1.本校結合創新實務與健康照護之專業特色,強調「學校整體」、「人才培育」、「教學績效」等概念及實踐,並配合技職教育課程的推展及延續產業協同教學的特色,清楚定位各學制的目標及規劃,以培育健康照護的專業人才。 2.本校積極建構從出生到死亡的健康照護模式,並在現有的醫護專業基礎上,發展優質教學環境、推動教學品質管理、拓展國際合作、以及強化全人教育之學習環境。 3.本校擁有完善的教學環境體制,為醫護技職專校學生更深入研修的第一志願,學制包含四技、二技、碩士在職專班、碩士與博士班。 4.本校擁有優秀專業師資,具博士級以上教師佔教師人數84%,並多具有豐富之臨床實務教學經驗。 5.本校擁有友善、親和、安全與適性特質的校園環境,近年來陸續設置「體適能中心、水療教育示範教學中心、茶藝軒、癒花園、臨床技能中心OSCE、生、老、病之主題花園」等設施,期使學生優遊涵泳於優質且安全的校園環境中快樂學習。"
113,公立,技專校院,0047,國立高雄餐旅大學,1122,0,862,103,78.78,"「人文化、專業化、企業化、國際化」治校理念,為全國唯一專精培育餐旅精英的搖籃。擁有優秀餐旅師資、落實產學共構課程、畢業前海外參訪、拓展視野養成國際觀,也積極與國內外知名企業建教合作,並與多國海外學校締結姊妺校,全面接軌國際化。具有完善勞作教育、新生住校、服儀規定。2024年,畢業生競爭力及國際聲望皆受業界高度肯定：遠見雜誌「2024臺灣最佳大學排行榜」,榮獲服務領域第1名、技職校院國際化程度第4名；國家圖書館「臺灣學術資源影響力」排名在公立技職校院中更獲學位論文取用貢獻第1名、學位論文開放貢獻及學位論文開放取用傑出貢獻皆第2名；國際聲望方面本校更榮獲「2024年QS世界大學之學科排行」餐旅暨休閒管理類全球第38名；本校校友亦多方展現摘星饗宴新食力,2024年共有8名校友榮獲米其林一星認證！本校學制有研究所、四技部、學士學位學程、五專部及進修推廣學制等,共有1博3所11系3學程1科。"
113,公立,一般大學,0048,國立金門大學,1065,0,841,83,80.49,"本校設有日間及進修學系,113學年度共有4個學院、17個學系、13個研究所碩士班、2個碩士在職專班、2個博士學位學程。本校位於獨特的地理位置與歷史中,以地方關懷、兩岸橋梁、世界接軌為發展重點。同時結合地方產業發展特色、善盡文化遺產的保存與發揚、配合兩岸情勢之變化及國家未來發展需求,培育未來人才。"
113,公立,一般大學,0049,國立臺灣體育運動大學,779,0,738,16,94.84,"一、本校為全臺首座體育專長學校,自民國50年創立至今,除了訓練優秀運動選手外,也培育運動產業相關人才,包括運動防護、舞蹈、休閒運動、運動管理、以及運動傳播人才。  二、近年來持續提升訓練環境、延攬優秀師資、課程與產業結合,使學生畢業即就業。  三、本校位居一中商圈,生活機能便捷,地理位置優越、交通便捷,南來北往便利無比。  四、培育中等學校體育及表藝專業師資,每年應屆通過率冠全台。"
113,公立,技專校院,0050,國立臺中科技大學,4856,0,4389,86,90.55,"本校以「落實創新服務」及「培育立型人才」為理念,現有日間部、進修部、空中學院,分設五年制、四年制、二年制等學制暨專科班、學士班、碩士班、碩士在職專班、博士班等班制；目前設有6個學院,分別為商學院、設計學院、語文學院、資訊與流通學院、中護健康學院及智慧產業學院等,類科前瞻務實,發展多元,提供學子適才適性之選擇,多軌並進,以培育「創新思維與跨域整合」之優秀技職專業人才。本校積極落實技職教育精神,強化教師業界實務經驗,重視學生專業知識及實作能力之養成,配合國家發展及產業趨勢設計各項通識及專業課程,以與產業界進行更深入的鏈結。本校全力推動教師落實將研究成果融入教學過程,改變教師教學方式與強化教學創新研發,以提升教師教學品質及學生學習成效。鼓勵學生進行跨域自主學習,並積極推動校外實習及專題實務課程,輔以業師協同教學,協助學生職涯發展,厚植職場競爭力,落實與產業接軌之目標。"
113,公立,技專校院,0051,國立臺北商業大學,1846,3,1664,50,90.54,"地理位置優越：臺北校區位於都會中心精華區；桃園校區位於平鎮區,交通便利；目前共有14個系所(含財經學院博士班)。學生素質優良：90％以上企業對本校畢業生工作表現評價滿意。在媒體調查中,本校為財經商管界育才搖籃,連續獲得「企業最愛大學」。多元職涯輔導：獎勵學生參與證照技能檢定,辦理多元職涯探索活動,發展適才適性的職業生涯。開創產學新契機：結合校友、政府及產業界資源,辦理產學合作。參賽獲佳績：鼓勵學生多元學習及創意思考,參與各國內外技能競賽,屢獲佳績。英語與跨文化學習：開設全英語課程,姊妹校遍及美國、加拿大、澳洲、德國、荷蘭、奧地利、法國、瑞典、葡萄牙、西班牙、日本、南韓、新加坡等國,鼓勵學生赴海外進修。跨校合作聯盟：參與區域產學合作、技專校院合作,建立策略聯盟。優秀傑出校友：在公私部門、政界、文教界表現可圈可點。獎助輔導完備：結合校內外資源,成立多項獎學金,讓學生安心就學。"
113,公立,一般大學,0052,國立屏東大學,2314,4,2038,26,88.36,"本校為高教、技職與師培三大體系,以多元合流為特色,並定位為「教學與科研融合型大學」。在學術組織上,設有教育學院、人文社會學院、理學院、管理學院、資訊學院、國際學院及大武山學院等七大學院。招生管道含括高教大學多元入學、公費生培育、四技聯合招生入學及各項本校單獨招生管道。為推展跨領域教學,規劃並開設各種跨領域課程、微學分課程及學分學程,鼓勵學生進行跨領域對話、科際交流,發掘與培養第二專長,另透過專題實作、校外實習與企業參訪等產學合作或建立教師專業社群,以工作坊或研討會等形式跨域交流,逐步達成學用合一之目標。本校具備師資培育的優良傳統、人文藝術理學的深厚基礎、數位科技的創新技能,及豐富的產學、實習與推廣教育經驗,教學及研究能量涵蓋各項專業領域；同時,鼓勵教師從事學術研究以豐厚專業根基：並以深植產學研發,提升師生實務專業與創新思考的能力,進而協助產業技術提升,帶動當地產業升級。"
113,公立,技專校院,0053,國立高雄科技大學,7647,7,6755,97,88.56,"本校自107年2月1日起由國立高雄應用科技大學、國立高雄第一科技大學及國立高雄海洋科技大學合併成為「國立高雄科技大學」,學術領域涵蓋工程、電機與資訊、智慧機電、海事、水圈、商業智慧、管理、海洋商務、財務金融、外語、創新設計等,教師專長及研究領域多樣且豐富,資源齊全,充分給予學生「深度」及「廣度」的學習機會,提供多元的跨域學習、永續學習的優良教育環境。培養學生成為全方位跨域、國際移動力、永續學習力及具人本關懷的人才。校地廣闊共有建工、燕巢、第一、楠梓及旗津5個校區, 113學年度招生學制設有10個學院、16個博士班、56個碩士班、45個碩專班、50個系/學位學程、4個專科,包含日間部及進修部,鄰近高雄工業區與科技園區,升學就業管道暢通,是南部技職教育的重鎮,培育產業發展人才之國際化典範大學。"
113,公立,技專校院,0144,國立臺灣戲曲學院,144,0,105,3,73.47,"本校為全國唯一本於「藝術教育法」精神,實施一貫制藝術教育的傳統表演藝術學府,以培育優質傳統戲曲專業人才為教育目標,建構我國教育史上第一個從國小、國中、高職、到大學的一貫制學制。依據各學系之專業教育理念與舞臺實踐需求,分別規劃從7年到12年的不同學程,透過循序漸進的課程架構,擇優直升的機制,落實專業人才養成教育。"
113,公立,技專校院,0221,國立臺南護理專科學校,422,0,399,2,94.58,"本校具備下列招生特色：一、地理位置優異：位於臺南市中心的鑽石地帶,距火車站約700公尺,交通便利,生活機能良好。二、優質教學環境：校園全面e化且設備新穎,設有基礎醫學實驗室、臨床技能模擬中心、高齡者全人照顧教學中心、日間照顧實務教學中心、健康促進教育中心、彩妝、美膚美體教室及整體造型專業教室、化妝品調劑檢驗實驗室、中草藥養生專業教室等教學相關設施,以加強學生專業學習。三、教學成效優異：護理科護理師執照考近年及格率平均約八成；化妝品應用科美容乙丙級及化學乙丙級相關專業證照通過率平均達八成以上,成績優異；老人服務事業科亦積極輔導學生取得長照相關證照。四、教育目標明確：本校秉持校訓「誠正、博愛、勤慎、負責」之精神,以健康「全人」的概念,結合生命、環境與品德教育,教授健康應用科學,以培養術德兼修的專業技術人才為辦學宗旨。"
113,公立,技專校院,0222,國立臺東專科學校,582,0,212,1,36.54,"本校以「務實致用之教學型專科學校」自我定位,以「培育東部產業人才搖籃、建立在地關懷技職典範」作為願景,並發展以下五大特色：  一、配合產業發展,培養在地人才：配合臺東地區產業發展,擬定各科發展重點技術,訂定學生培訓計畫。  二、融合多元文化,關懷弱勢族群：結合創意及技術,提升文化產業價值；加強服務學習理念,培養社會關懷胸襟。  三、促進兩部攜手,共創雙贏契機：落實分權分責分享的賦權原則,以及共治共決共生的團隊精神,開創技能升級契機。  四、運用在地資源,研發特色產品：運用在地自然及人文資源,配合各科發展主軸,研發一科一特色產品。  五、建構技訓平臺,推動實務增能：建構技能與職業訓練平臺,縮短學用落差,與產業無縫接軌,提升學生就業力。"
113,私立,一般大學,1001,東海大學,4001,4,3711,190,93.17,"東海大學創校69年,設有文、理、工、管理、社科、農健、創藝、法、國際等九大學院,學生逾1萬5千名,是一所深具博雅底蘊的未來大學。本校以學生為中心,推動翻轉教學、整合科技實踐、培育永續跨域並兼具博雅精神及國際觀之人才。為拓展學生國際化視野,積極延攬外籍師資,與國外姊妹校結盟交流達千項。本校設有學士班、進修學士班、碩士班、碩士在職專班、博士班。為使學生有更多元的發展,提供雙主修、輔系、學分學程、微學分課程、海內外實習。因應未來趨勢,設有「跨域創新學院」、「實習與學生成就中心」,強化學生就業競爭力,創造跨域人才。本校連續4年奪下泰晤士「世界大學影響力排名」私校第一,2024年榮獲亞太暨台灣永續行動獎三金一銀、「天下USR大學公民」調查私立大學第一、《Cheer》雜誌全台辦學績效最佳大學「辦學績效卓越獎」等殊榮,展現出在學術與實務上的卓越表現。"
113,私立,一般大學,1002,輔仁大學,6603,3,6244,200,94.76,"輔仁大學以學生為中心提供豐富資源及全方位服務與輔導。著力於營造充滿文藝氣息及設計美學元素之學生幸福學習空間,打造跨領域的學習環境。除學習環境營造外,更重視大一新生的啟蒙與輔導,落實導師制度以啟發菁英學生為主要教育職志。並體現天主教精神實踐輔大社會責任,包含：原住民族地區地方創生、新五泰地區永續發展與人才培育。向來以學風自由著稱的輔大,全校共12學院53學系/學程的主修領域及創新跨領域學院、全人教育中心等,讓學生有機會接觸到不同面向的課程。除主修學系外,亦提供豐沛的跨域學習機會,學生可選擇跨領域雙主修、輔系及跨域學院的58個跨域(微)學分學程,結合健康醫療、音樂治療、人文藝術、AI科技、視覺設計、金融科技、大數據智慧行銷等,築基於12學院的養分,成就樣貌豐富的跨域學習環境。本校國際姊妹校450餘所,透過校園國際交流活動,建構學生外語學習環境,打造校園國際化氛圍,讓輔大走向世界,世界走入輔大。"
113,私立,一般大學,1003,東吳大學,3723,2,3531,36,94.94,"東吳大學1900年於蘇州創立,是中國高教史上最早設立的西制大學；1954年獲准在臺復校,為臺灣第一所私立大學,是所樸實自持、開明超然、根柢深厚的綜合大學。設有6學院,院系組合完整,並提供連續學習的碩博士班與回流教育體系,成為企業最愛大學生及研究生的搖籃。師資優秀,學風自由,擁有豐富的圖書資源,專精卓越的教學內涵。兩校區地理環境優越,交通便捷。外雙溪校區依山傍水,臨近故宮,文化底蘊深厚；城中校區位居臺北市政治經濟中心,資源豐富,有利師生觀摩實習與實務歷練。本校以「養天地正氣,法古今完人」的辦學理念,秉持「打造勇於創新、落實創意、引導創業三創優質學習環境,培養放眼世界、回饋社會,能於數位科技新潮流與時俱進適性人才」發展願景,已成為頗具聲望的高等學府,深獲各界肯定。連續多年獲教育部教學卓越與高教深耕計畫肯定,榮獲教育部112年大專校院特殊教育特色學校獎及2023年臺灣學術資源影響力獎,成績斐然。"
113,私立,一般大學,1004,中原大學,4215,0,4100,215,97.40,"以「中原認同,學習共榮,知識扎根,育才招生」的方式,實行教研合一的招生政策,為落實學生適性學習與學用合一,以及本校「天」、「人」、「物」、「我」的全人教育理念內涵,推出多項特色教育方案,以提供學生多元且優質的學習環境,例如：1.首推學術與實務課程分流學習框架：落實適性教育之理念,以學習者為本位,啟動課程再造工程,提供符合學生發展需求的課程分流架構,進而縮短「學用落差」。2.創建學用合一導向的大學就業學程：以學習者為本位,提供5大類學程,包含企業學程、創業學程、公職學程、教育學程與領導學程等,強化與產業之鏈接,除了滿足學生多元發展之需求,更提供「畢業後即就業」的發展管道,以有效縮短學用落差之人才培育目標。3.建立落實適性教育的彈性轉系制度：打破全國以學業成績為標準的轉系方法,全面改採面試審查,以落實適性教育之理念、有效減低學生非自願性延畢。"
